{
  "$schema": "https://json-schema.org/draft/2020-12/schema",
  "$id": "https://koalapet.invalid/schemas/0.1/progression-balance.schema.json",
  "title": "Progression balance 0.1",
  "type": "object",
  "required": ["id", "display_name_key", "level_cap", "level_thresholds", "battle_gate_id", "dungeon_gate_id", "injury_ids"],
  "properties": {"$schema": {"type": "string"}, "id": {"type": "string", "pattern": "^[a-z][a-z0-9_.-]*:[a-z][a-z0-9_.-]*$"}, "display_name_key": {"type": "string"}, "level_cap": {"type": "integer", "minimum": 1}, "level_thresholds": {"type": "array", "minItems": 1, "items": {"type": "integer", "minimum": 0}}, "battle_gate_id": {"type": "string", "pattern": "^[a-z][a-z0-9_.-]*:[a-z][a-z0-9_.-]*$"}, "dungeon_gate_id": {"type": "string", "pattern": "^[a-z][a-z0-9_.-]*:[a-z][a-z0-9_.-]*$"}, "injury_ids": {"type": "array", "minItems": 1, "uniqueItems": true, "items": {"type": "string", "pattern": "^[a-z][a-z0-9_.-]*:[a-z][a-z0-9_.-]*$"}}},
  "additionalProperties": false
}
